{
  "title": "Sample Data Visualization",
  "yLabel": "Values",
  "xLabel": "Categories",
  "groups": [
    {
      "label": "Group 1",
      "series": [
        {
          "label": "Series 1",
          "value": 123.45
        },
        {
          "label": "Series 2",
          "value": 678.90
        }
      ]
    },
    {
      "label": "Group 2",
      "series": [
        {
          "label": "Series 1",
          "value": 135.79
        },
        {
          "label": "Series 2",
          "value": 246.80
        }
      ]
    },
    {
      "label": "Group 3",
      "series": [
        {
          "label": "Series 1",
          "value": 111.11
        },
        {
          "label": "Series 2",
          "value": 222.22
        },
        {
          "label": "Series 3",
          "value": 333.33
        }
      ]
    },
    {
      "label": "Group 4",
      "series": [
        {
          "label": "Series 1",
          "value": 444.44
        },
        {
          "label": "Series 2",
          "value": 555.55
        },
        {
          "label": "Series 3",
          "value": 666.66
        },
        {
          "label": "Series 4",
          "value": 777.77
        }
      ]
    },
    {
      "label": "Group 5",
      "series": [
        {
          "label": "Series 1",
          "value": 888.88
        },
        {
          "label": "Series 2",
          "value": 999.99
        },
        {
          "label": "Series 3",
          "value": 101.10
        },
        {
          "label": "Series 4",
          "value": 202.20
        },
        {
          "label": "Series 5",
          "value": 303.30
        }
      ]
    }
  ],
  "display": {
    "barSeriesFontStyle":"font-family: Arial,Helvetica, sans-serif; fill: #fcfcfc; font-size:9px; text-anchor:middle",
    "barSeriesLabelFontStyle":"font-family: Arial,Helvetica, sans-serif; fill: #fcfcfc; font-size:9px; text-anchor:start;",
    "barFontValueStyle":"font-family: Arial,Helvetica, sans-serif; fill: #fcfcfc; font-size:9px;",
    "titleStyle":"font-family: Arial,Helvetica, sans-serif; fill: #fcfcfc; font-size:14px; text-anchor:middle",
    "xLabelStyle":"font-family: Arial,Helvetica, sans-serif; fill: #fcfcfc; font-size:12px; text-anchor:middle",
    "yLabelStyle": "font-family: Arial,Helvetica, sans-serif; fill: #fcfcfc; font-size:12px; text-anchor:middle",
    "lineColor": "#FFBB5C",
    "vBar": false,
    "baseColor": "#F9F5F6"

  }
}