{
  "title": "Annual Product Sales Report - 2024",
  "yLabel": "Sales (USD)",
  "xLabel": "Quarters",
  "groups": [
    {
      "label": "Product A",
      "series": [
        {
          "label": "Product A Q1",
          "value": 5000.0
        },
        {
          "label": "Product A Q2",
          "value": 7000.0
        },
        {
          "label": "Product A Q3",
          "value": 8000.0
        },
        {
          "label": "Product A Q4",
          "value": 6000.0
        }
      ]
    },
    {
      "label": "Product B",
      "series": [
        {
          "label": "Product B Q1",
          "value": 6000.0
        },
        {
          "label": "Product B Q2",
          "value": 8000.0
        },
        {
          "label": "Product B Q3",
          "value": 7000.0
        },
        {
          "label": "Product B Q4",
          "value": 9000.0
        }
      ]
    },
    {
      "label": "Product C",
      "series": [
        {
          "label": "Product C Q1",
          "value": 6000.0
        },
        {
          "label": "Product C Q2",
          "value": 8000.0
        },
        {
          "label": "Product C Q3",
          "value": 7000.0
        },
        {
          "label": "Product C Q4",
          "value": 9000.0
        }
      ]
    },
    {
      "label": "Product D",
      "series": [
        {
          "label": "Product D Q1",
          "value": 2000.0
        },
        {
          "label": "Product D Q2",
          "value": 5000.0
        },
        {
          "label": "Product D Q3",
          "value": 0.0
        },
        {
          "label": "Product D Q4",
          "value": 2000.0
        }
      ]
    }
  ],
  "display": {
    "baseColor": "#1f2937",
    "barSeriesFontStyle": "font-family: Arial,Helvetica, sans-serif; fill: #fcfcfc; font-size:9px; text-anchor:middle",
    "barSeriesLabelFontStyle": "font-family: Arial,Helvetica, sans-serif; fill: #fcfcfc; font-size:11px; text-anchor:start;",
    "barFontValueStyle": "font-family: Arial,Helvetica, sans-serif; fill: #fcfcfc; font-size:9px;",
    "titleStyle": "font-family: Arial,Helvetica, sans-serif; fill: #fcfcfc; font-size:14px; text-anchor:middle",
    "xLabelStyle": "font-family: Arial,Helvetica, sans-serif; fill: #fcfcfc; font-size:12px; text-anchor:middle",
    "yLabelStyle": "font-family: Arial,Helvetica, sans-serif; fill: #fcfcfc; font-size:12px; text-anchor:middle",
    "lineColor": "#1f2937",
    "scale": 0.8,
    "vBar": true,
    "useDark": true
  }
}